,,,,,,,,,"Додаток  2",,,,,,,,,,
"090413","Допомога на догляд за інвалідом І чи II групи внаслідок психічного розладу",0.00,,,0.00,,,,,,,0.00,0,0.0,1,,,,
"090417","Витрати на поховання учасників бойових дій та інвалідів війни","737,300.00",,,0.00,,,,,,,"737,300.00",,"737,300.0",,,,,
"090601","Будинки-інтернати для малолітніх інвалідів","8,713,400.00","4,186,300.00","831,100.00","1,539,000.00","1,422,000.00",,,"117,000.00","20,000.00","20,000.00","10,252,400.00",,"10,252,400.0",,,,,
"090700","Утримання закладів, що надають соціальні послуги дітям, які опинились в складних життєвих обставинах","2,212,400.00","1,019,700.00","206,500.00","350,000.00",,,,"350,000.00","350,000.00","350,000.00","2,562,400.00",2562400,"2,562,400.0",,,,,
"090802","Інші  програми  соціального захисту дітей","238,000.00",,,0.00,,,,,,,"238,000.00",,"238,000.0",,,,,
"090901","Будинки-інтернати (пансіонати) для літніх людей та інвалідів системи соціального захисту","53,852,800.00","27,061,000.00","7,707,000.00","20,948,000.00","19,343,000.00",,"68,000.00","1,605,000.00","600,000.00","600,000.00","74,800,800.00",74800800,"74,800,800.0",1,,,,
91000,"Програми  і  заходи ",,,,0.0,,,,,,,0.0,,0.0,,,,,
,"з них на заходи щодо посилення захисту багатодітних сімей ",,,,0.0,,,,,,,0.0,0,0.0,1,,,,
"091101","Утримання центрів соціальних служб для сім'ї, дітей та молоді","1,259,800.00","813,200.00","72,700.00","30,000.00","30,000.00",,,,,,"1,289,800.00",1289800,"1,289,800.0",1,,,,
,,,,,0.0,,,,,,,0.0,0,0.0,1,,,,
"091102","Програми і заходи центрів соціальних служб для сім'ї, дітей та молоді","106,500.00",,,0.00,,,,,,,"106,500.00",106500,"106,500.0",1,,,,
"091103","Соціальні програми і заходи державних органів у справах молоді","1,744,500.00",,,0.00,,,,,,,"1,744,500.00",1744500,"1,744,500.0",1,,,,
91104,"Соціальні програми і заходи державних органів у справах жінок",,,,0.0,,,,,,,0.0,,0.0,,,,,
91105,"Утримання клубів підлітків за місцем проживання",,,,0.0,,,,,,,0.0,0,0.0,1,,,,
"091106","Інші видатки ","1,384,400.00","738,000.00","165,000.00","5,000.00","5,000.00",,,,,,"1,389,400.00",,"1,389,400.0",,,,,
"091108","Заходи з оздоровлення та відпочинку дітей, крім заходів з оздоровлення дітей, що здійснюються за рахунок коштів на оздоровлення громадян, які постраждали внаслідок Чорнобильської катастрофи","12,422,500.00",,,"550,000.00","550,000.00",,,,,,"12,972,500.00",12972500,"12,972,500.0",1,,,,
,"у тому числі: програма щодо посилення соціального захисту багатодітних сімей, що проживають на території Львівської області",,,,,,,,,,,0.0,,0.0,,,,,
91109,"Облаштування новостворюваних закладів, які надають соціальні послуги дітям та молоді",,,,0.0,,,,,,,0.0,0,0.0,1,,,,
91201,"Будівництво житла та об'єктів інфраструктури для кримськотатарського народу та осіб інших національностей, які повертаються в Україну",,,,0.0,,,,,,,0.0,0,0.0,,,,,
"091203","Навчання та трудове влаштування інвалідів","9,216,500.00","4,098,400.00","954,900.00","90,000.00",,,,"90,000.00","90,000.00","90,000.00","9,306,500.00",9306500,"9,306,500.0",,,,,
"091206","Центри соціальної реабілітації дітей-інвалідів; центри професійної реабілітації інвалідів","2,255,700.00","884,400.00","38,000.00","140,000.00",,,,"140,000.00","140,000.00","140,000.00","2,395,700.00",2395700,"2,395,700.0",1,,,,
91207,"Пільги,       що       надаються населенню   (крім  ветеранів війни та праці)    по оплаті житлово-комунальних послуг і природного газу",,,,0.0,,,,,,,0.0,0,0.0,,,,,
"091209","Фінансова підтримка громадських організацій інвалідів і ветеранів","260,000.00",,,0.00,,,,,,,"260,000.00",,"260,000.0",,,,,
,"з них на: реалізацію Комплексної програми соціальної підтримки окремих категорій громадян",0.00,,,,,,,,,,0.00,,0.0,,,,,
91210,"Служба технічного нагляду за будівництвом та капітальним ремонтом",,,,0.0,,,,,,,0.0,0,0.0,,,,,
91209,"Фінансова підтримка громадських організацій інвалідів і ветеранів",,,,0.0,,,,,,,0.0,0,0.0,1,,,,
,"з них на:",,,,,,,,,,,,,,,,,,
,"реалізацію Комплексної програми соціальної підтримки окремих категорій громадян Львівської області на 2011-2013 роки в частині надання фінансової підтримки громадським організаціям інвалідів, ветеранів та політичних в’язнів і репресованих, які мають статус обласних, для здійснення їх статутної діяльності",,,,,,,,,,,0.00,,0.0,,,,,
"091212","Обробка інформації з нарахування та виплати допомог і компенсацій ","1,642,100.00","946,000.00","45,200.00","80,000.00",,,,"80,000.00","80,000.00","80,000.00","1,722,100.00",1722100,"1,722,100.0",,,,,
"091214","Інші установи та заклади","600,000.00","273,100.00","8,400.00",0.00,,,,,,,"600,000.00",600000,"600,000.0",,,,,
"091303","Компенсаційні виплати інвалідам на бензин, ремонт, техобслуговування автотранспорту та транспортне обслуговування","731,800.00",,,0.00,,,,,,,"731,800.00",,"731,800.0",,,,,
"091304","Встановлення телефонів інвалідам І та ІІ груп","50,000.00",,,0.00,,,,,,,"50,000.00",50000,"50,000.0",1,,,,
91301,"Здійснення виплат, визначених Законом України ""Про реструктуризацію заборгованості з виплат, передбачених ст.57 Закону України ""Про освіту"" педагогічним, науково-педагогічним та іншим категоріям працівників навчальних закладів",,,,0.0,,,,,,,0.0,,0.0,,,,,
100000,"Житлово-комунальне господарство","300,000.00",0.00,0.00,0.00,0.00,0.00,0.00,0.00,0.00,0.00,"300,000.00",300000,"300,000.0",1,,,,
100101,"Житлово-експлуатаційне господарство",0.0,0.0,0.0,0.0,0.0,0.0,,0.0,,0.0,0.0,0,0.0,1,,,,
100105,"Видатки на утримання об'єктiв соцiальної сфери підприємств, що передаються до комунальної власностi",,,,0.0,,,,,,,0.0,,0.0,,,,,
100201,"Тепловi мережi",,,,0.00,,,,0.00,0.00,0.00,0.00,,0.0,,,,,
100202,"Водопровiдно - каналiзацiйне господарство",,,,0.0,,,,,,,0.0,,0.0,,,,,
100203,"Благоустрiй мiст, сіл, селищ",,,,0.0,,,,,,,0.0,0,0.0,1,,,,
100209,"Заходи, пов""язані з поліпшенням питної води","300,000.00",,,0.00,,,,,0.00,0.00,"300,000.00",,"300,000.0",,,,,
100302,"Комбінати комунальних підприємств, районні виробничі об""єднання та інші підприємства, установи та організації житлово-комунального господарства (видатки на утримання і обслуговування майна обласної комунальної власності)",,,,0.0,,,,,,,0.0,0,0.0,,,,,
100303,"Ремонтно-будівельні організації житлово-комунального господарства",,,,0.0,,,,,,,0.0,,0.0,,,,,
100400,"Підприємства і організації побутового обслуговування, що входять до комунальної власності",,,,0.0,,,,,,,0.0,,0.0,,,,,
100501,"Видатки на заходи щодо оплати громадянам електричної і теплової енергії, природного газу, твердого палива, послуг водопостачання і водовідведення, квартирної плати в рахунок часткової компенсації втрат від знецінення грошових заощаджень  ",,,,0.0,,,,,,,0.0,,0.0,,,,,
100601,"Погашення заборгованості минулих років з різниці в тарифах на теплову енергію, послуги з водопостачання та водовідведення, що постачалися населенню, яка виникла у зв'язкуз невідповідністю фактичної вартості теплової енергії, послуг з водопостачання та водовідведення тарифам, що затверджувалися органами державної влади чи органами місцевого самоврядування",,,,0.0,,,,,,,0.0,,0.0,,,,,
110000,"Культура і мистецтво","98,936,100.00","29,000,300.00","2,987,900.00","3,678,300.00","1,957,200.00","236,100.00","30,700.00","1,721,100.00","1,035,000.00","1,035,000.00","102,614,400.00",102614400,"102,614,400.0",,,,,
,"з них видатки пов""язані з заходами щодо енергозбереження",,,,0.0,,,,,,,0.0,,0.0,,,,,
,"з них  на:",,,,0.0,,,,,,,0.0,0,,,,,,
,"видатки з енергозбереження",,,,0.0,,,,,,,0.0,0,,,,,,
,"на реалізацію обласної цільової програми підготовки та проведення в Україні фінанльної частини чемпіонату Європи 2012 року з футболу",,,,0.0,,,,,,,0.0,,0.0,1,,,,
,"погашення кредиторської заборгованості за 2009 рік",,,,0.0,,,,,,,0.0,0,0.0,1,,,,
110101,"Творчі спілки",,,,0.0,,,,,,,0.0,,0.0,,,,,
110102,"Театри","12,232,400.00",,,0.00,,,,,,,"12,232,400.00",,"12,232,400.0",,,,,
110103,"Філармонії, музичні колективи і ансамблі та інші мистецькі заклади та заходи","32,846,400.00",,,0.00,,,,,,,"32,846,400.00",,"32,846,400.0",,,,,
110104,"Видатки на заходи, передбачені державними і місцевими програмами розвитку культури і мистецтва","500,000.00",,,0.00,,,,0.00,0.00,0.00,"500,000.00",,"500,000.0",,,,,
110105,"Фінансова підтримка гастрольної діяльності",,,,0.00,,,,,,,0.00,,0.0,,,,,
110201,"Бібліотеки","15,021,900.00","9,908,700.00","514,200.00","974,300.00","29,300.00",,"10,700.00","945,000.00","945,000.00","945,000.00","15,996,200.00",,"15,996,200.0",,,,,
110202,"Музеї і виставки","31,796,100.00","15,892,400.00","2,266,600.00","2,134,000.00","1,467,000.00",,"20,000.00","667,000.00",,,"33,930,100.00",,"33,930,100.0",,,,,
110203,"Заповідники","3,324,700.00","1,518,500.00","129,200.00","380,000.00","372,000.00","200,000.00",,"8,000.00",,,"3,704,700.00",,"3,704,700.0",,,,,
110204,"Палаци і будинки культури, клуби та інші заклади клубного типу",,,,0.0,,,,,,,0.0,,0.0,,,,,
110205,"Школи естетичного виховання дітей",,,,0.0,,,,,,,0.0,,0.0,,,,,
110206,"Здійснення виплат, визначених Законом України ""Про реструктуризацію заборгованості з виплат, передбачених ст.57 Закону України ""Про освіту"" педагогічним, науково-педагогічним та іншим категоріям працівників навчальних закладів",,,,0.0,,,,,,,0.0,,0.0,,,,,
110300,"Кінематографія","231,800.00",,,0.00,,,,,,,"231,800.00",,"231,800.0",,,,,
110502,"Інші культурно-освітні заклади та заходи","2,982,800.00","1,680,700.00","77,900.00","190,000.00","88,900.00","36,100.00",,"101,100.00","90,000.00","90,000.00","3,172,800.00",,"3,172,800.0",,,,,
120000,"Засоби  масової інформації","6,530,000.00",0.00,0.00,"2,900,000.00",0.00,0.00,0.00,"2,900,000.00","2,900,000.00","2,900,000.00","9,430,000.00",,"9,430,000.0",,,,,
,"з них на регіональну програму розвитку інформаційного простору",,,,0.0,,,,,,,0.0,,0.0,,,,,
120100,"Телебачення і радіомовлення","4,897,000.00",,,"2,900,000.00",,,,"2,900,000.00","2,900,000.00","2,900,000.00","7,797,000.00",,"7,797,000.0",,,,,
120201,"Періодичні видання (газети та журнали)","598,000.00",,,0.00,,,,,,,"598,000.00",,"598,000.0",,,,,
120300,"Книговидання","936,000.00",,,0.00,,,,,,,"936,000.00",,"936,000.0",,,,,
120400,"Інші засоби масової інформації","99,000.0",,,0.0,,,,,,,"99,000.0",,"99,000.0",,,,,
130000,"Фізична культура і спорт","40,541,200.00","6,892,300.00","255,900.00","4,333,500.00","313,500.00","177,500.00","16,000.00","4,020,000.00","4,020,000.00","4,020,000.00","44,874,700.00",,"44,874,700.0",,,,,
,"з них  на:",,,,0.0,,,,,,,0.0,,,,,,,
,"енергозбереження",,,,0.0,,,,,,,0.0,,0.0,,,,,
,"погашення кредиторської заборгованості за 2009 рік",,,,0.0,,,,,,,0.0,0,0.0,1,,,,
130102,"Проведення навчально-тренувальних зборів і змагань","7,331,800.00",,,0.00,,,,,,,"7,331,800.00",,"7,331,800.0",,,,,
130104,"Видатки на утримання центрів з інвалідного спорту і реабілітаційних шкіл","1,503,600.00","937,100.00","25,000.00","165,500.00","165,500.00","125,000.00",,0.00,0.00,0.00,"1,669,100.00",,"1,669,100.0",,,,,
130105,"Проведення навчально-тренувальних зборів і змагань та заходів з інвалідного спорту","290,000.00",,,0.00,,,,,,,"290,000.00",,"290,000.0",,,,,
130106,"Проведення заходів з нетрадиційних видів спорту і масових заходів з фізичної культури",,,,0.0,,,,,,,0.0,,0.0,,,,,
130107,"Утримання та навчально-тренувальна робота дитячо-юнацьких спортивних шкіл","4,752,500.00","2,826,700.00","174,700.00","108,000.00","88,000.00","52,500.00","10,000.00","20,000.00","20,000.00","20,000.00","4,860,500.00",,"4,860,500.0",,,,,
130110,"Фінансова підтримка спортивних споруд ",,,,0.0,,,,,,,0.0,,0.0,,,,,
130112,"Інші видатки",,,,0.0,,,,,0.0,0.0,0.0,,0.0,,,,,
130113,"Централізовані бухгалтерії",,,,0.0,,,,,,,0.0,,0.0,,,,,
130114,"Забезпечення підготовки спортсменів вищих категорій школами вищої спортивної майстерності","6,148,700.00","2,880,000.00","28,700.00","4,060,000.00","60,000.00",,"6,000.00","4,000,000.00","4,000,000.00","4,000,000.00","10,208,700.00",,"10,208,700.0",,,,,
130115,"Центри ""Спорт для всіх"" та заходи з фізичної культури","548,500.00","248,500.00","27,500.00",0.00,,,,,,,"548,500.00",,"548,500.0",,,,,
130201,"Проведення навчально-тренувальних зборів і змагань (які прводяться громадськими організаціями фізкультурно-спортивної спрямованості)",,,,0.0,,,,,,,0.0,,0.0,,,,,
130202,"Проведення заходів з нетрадиційних видів спорту і масових заходів з фізичної культури (які проводяться громадськими організаціями фізкультурно-спортивної спрямованості)",,,,0.0,,,,,,,0.0,,0.0,,,,,
130203,"Утримання та навчально-тренувальна робота дитячо-юнацьких спортивних шкіл (які підпорядковані громадським організаціям фізкультурно-спортивної спрямованості)","17,400,000.00",,,0.00,,,,,,,"17,400,000.00",,"17,400,000.0",,,,,
130204,"Утримання апарату управління громадських фізкультурно-спортивних організацій  (ФСТ ""Колос"")","566,100.00",,,0.00,,,,,,,"566,100.00",,"566,100.0",,,,,
130205,"Фінансова підтримка спортивних споруд, які належать громадським організаціям фізкультурно - спортивної спрямованості (ФСТ ""Динамо"")","2,000,000.00",,,0.00,,,,,,,"2,000,000.00",,"2,000,000.0",,,,,
150000,"Будівництво","2,698,000.00",0.00,0.00,"18,847,800.00",0.00,0.00,0.00,"18,847,800.00","18,847,800.00","11,700,000.00","21,545,800.00",,"21,545,800.0",,,,,
,"з них на:",,,,,,,,,,,0.0,,,,,,,
,"погашення кредиторської заборгованості за 2009 рік",,,,0.0,,,,,0.0,,0.0,,0.0,,,,,
150101,"Капітальні вкладення",0.00,,,"18,047,800.00",,,,"18,047,800.00","18,047,800.00","10,900,000.00","18,047,800.00",18047800,"18,047,800.0",1,,,,
150107,"Житлове будівництво і придбання житла військовослужбовцям та особам рядового і начальницького складу, звільненим у запас або відставку за станом здоров""я, віком, вислугою років та у зв""язку із скороченням штатів, які перебувають на квартирному обліку за місцем проживання, членам сімей з числа цих осіб, які загинули під час виконання ними службових обов""язків, а також учасникам бойових дій в Афганістані та воєнних конфліктів",,,,0.0,,,,,0.0,,0.0,,0.0,,,,,
150110,"Проведення невідкладних відновлювальних робіт, будівництво та реконструкція загальноосвітніх навчальних закладів ",,,,0.00,,,,,0.00,,0.00,,0.0,,,,,
150111,"Проведення невідкладних відновлювальних робіт, будівництво та реконструкція спеціалізованих навчальних закладів ",,,,0.00,,,,,0.00,,0.00,,0.0,,,,,
150112,"Проведення невідкладних відновлювальних робіт, будівництво та реконструкція позашкільних навчальних закладів ",,0.00,0.00,0.00,,0.00,0.00,,0.00,,0.00,0,0.0,1,,,,
150114,"Проведення невідкладних відновлювальних робіт, будівництво та реконструкція лікарень загального профілю",,,,0.00,,,,,0.00,,0.00,0,0.0,1,,,,
150118,"Житлове будівництво та придбання житла для окремих категорій населення",,,,0.00,,,,,0.00,0.00,0.00,0,0.0,1,,,,
150119,"Проведення невідкладних відновлювальних робіт, будівництво та реконструкція спеціалізованих лікарень та інших спеціалізованих закладів",,,,0.00,,,,,0.00,,0.00,,0.0,,,,,
150120,"Будівництво та розвиток мережі метрополітенів ",,,,0.0,,,,,0.0,,0.0,,0.0,,,,,
150121,"Заходи з упередження аварій та запобігання техногенних катастроф у житлово-комунальному господарстві та інших аварійних об'єктах комунальної власності",,,,0.0,,,,,0.0,,0.0,,0.0,,,,,
150122,"Інвестиційні проекти",,,,0.0,,,,,0.0,,0.0,,0.0,,,,,
150201,"Збереження, розвиток, реконструкція та реставрація пам’яток історії та культури","2,048,000.00",,,"800,000.00",,,,"800,000.00","800,000.00","800,000.00","2,848,000.00",,"2,848,000.0",,,,,
150202,"Розробка схем та проектних рішень масового застосування",,,,0.0,,,,,0.0,,0.0,,0.0,,,,,
150203,"Операційні видатки-паспортизація, інвентаризація пам""яток архітектури, премії в галузі архітектури","650,000.00",,,0.00,,,,0.00,0.00,0.00,"650,000.00",,"650,000.0",,,,,
150117,"Повернення коштів, наданих для кредитування  громадян на будівництво (реконструкцію) житла",,,,0.0,,,,,0.0,,0.0,,0.0,,,,,
150202,"Розробка схем та проектних рішень масового застосування",,,,0.0,,,,,0.0,,0.0,,0.0,,,,,
160000,"Сільське і лісове господарство, рибне господарство та мисливство","7,100,000.00",0.00,0.00,"3,000,000.00",0.00,0.00,0.00,"3,000,000.00",0.00,0.00,"10,100,000.00",,"10,100,000.0",,,,,
,"з них на:",,,,0.0,,,,,0.0,,0.0,,,,,,,
,"погашення кредиторської заборгованості за 2009 рік",,,,0.0,,,,,0.0,,0.0,,0.0,,,,,
160101,"Землеустрій",,,,0.0,,,,0.0,,0.0,0.0,,0.0,1,,,,
160600,"Лісове господарство і мисливство",,,,0.00,,,,,,,0.00,,0.0,,,,,
160903,"Програми в галузі сільського господарства , лісового господарства, рибальства та мисливства","7,100,000.00",,,"3,000,000.00",0.00,,,"3,000,000.00",,,"10,100,000.00",10100000.0,"10,100,000.0",1,,,,
,"у тому числі                                                                                                                                                               відшкодування сільськогосподарським підприємствам втрат за продаж зерна у стабілізаційний фонд",,,,0.0,,,,,,,0.0,,0.0,1,,,,
,"у тому числі землеустрій у сільській місцевості",,,,0.0,,,,,,,0.0,,0.0,,,,,
,,,0.0,0.0,0.0,,,,,,,0.0,0.0,0.0,1,,,,
170000,"Транспорт,  дорожнє господарство, зв'язок, телекомунікації та інформатика","20,215,700.00",0.00,0.00,"18,000,000.00",0.00,0.00,0.00,"18,000,000.00",0.00,0.00,"38,215,700.00",,"38,215,700.0",,,,,
,"з них:",,,,,,,,,,,0.00,,,,,,,
